linkedinProfile,email,headline,location,imgUrl,firstName,lastName,fullName,subscribers,connectionDegree,vmid,userId,linkedinSalesNavigatorUrl,connectionsUrl,mutualConnectionsUrl,company,companyUrl,jobTitle,jobLocation,jobDateRange,company2,companyUrl2,jobTitle2,jobLocation2,jobDateRange2,school,schoolUrl,schoolDegree,schoolDegreeSpec,schoolDateRange,school2,schoolUrl2,schoolDegree2,schoolDateRange2,companyWebsite,allSkills,skill1,endorsement1,skill2,endorsement2,skill3,endorsement3,skill4,endorsement4,skill5,endorsement5,skill6,endorsement6,baseUrl,profileId,timestamp,description,jobDescription,schoolDegreeSpec2
https://www.linkedin.com/in/viswanath-aditya-gamini-90b92292/,,Developer,"Bangalore Urban, Karnataka, India",https://media-exp1.licdn.com/dms/image/C4E03AQHMni1HBL833g/profile-displayphoto-shrink_800_800/0/1593193343372?e=1637193600&v=beta&t=G9h0X-ODqT9Fdw15q5BlyXZUAjI2Y13JEY-Ub_pU5Vo,Viswanath Aditya,Gamini,Viswanath Aditya Gamini,966,3rd+,ACoAABO2wJsBqzpR6X-wZmm3R89HycWK3cq2z5A,330743963,"https://www.linkedin.com/sales/people/ACoAABO2wJsBqzpR6X-wZmm3R89HycWK3cq2z5A,name",https://www.linkedin.com/search/results/people/?facetConnectionOf=%5B%22ACoAABO2wJsBqzpR6X-wZmm3R89HycWK3cq2z5A%22%5D&facetNetwork=%5B%22F%22%2C%22S%22%5D&origin=MEMBER_PROFILE_CANNED_SEARCH,https://www.linkedin.com/search/results/people/?facetNetwork=%5B%22F%22%5D&facetConnectionOf=%5B%22ACoAABO2wJsBqzpR6X-wZmm3R89HycWK3cq2z5A%22%5D&origin=MEMBER_PROFILE_CANNED_SEARCH&RESULT_TYPE=PEOPLE,Money View,https://www.linkedin.com/company/money-view/,SDE,"Bengaluru Area, India",Oct 2019 – Present,NIIT Technologies,https://www.linkedin.com/company/niittechnologies/,Senior Software Engineer,"Bengaluru, Karnataka, India",Oct 2017 – Sep 2019,Thapar Institute of Engineering and Technology,https://www.linkedin.com/school/156018/?legacySchoolId=156018,Bachelor of Engineering (B.E.),Computer Engineering,2012 – 2016,Ascent Classes,https://www.linkedin.com/school/477042/?legacySchoolId=477042,Intermediate,2010 – 2012,https://moneyview.in,"C++, C, Java, Photography, Spring Framework, SQL, MongoDB, HTML, CSS, jQuery, Angular 4, AngularJS, JavaScript, REST, Microsoft Word, Microsoft Office, PowerPoint, Microsoft Excel, MS SQL, JIRA, Weka",C++,8,C,10,Java,6,Photography,3,Spring Framework,0,SQL,4,https://www.linkedin.com/in/viswanath-aditya-gamini-90b92292,viswanath-aditya-gamini-90b92292,2021-09-12T16:05:14.865Z,,,
https://www.linkedin.com/in/varsha-mandloi-a35747122/,,Full Stack Developer,"Bangalore Urban, Karnataka, India",https://media-exp1.licdn.com/dms/image/C5603AQGpSzzuwg_LgQ/profile-displayphoto-shrink_800_800/0/1627491431832?e=1637193600&v=beta&t=JVV9eJJc9YiFuKAPlOCt89DlvBW145UipNz6xxBPzhA,varsha,mandloi,varsha mandloi,489,3rd+,ACoAAB5drQkBVCiWvwyn6Cjt8rJy3KhkpwymuVw,509455625,"https://www.linkedin.com/sales/people/ACoAAB5drQkBVCiWvwyn6Cjt8rJy3KhkpwymuVw,name",https://www.linkedin.com/search/results/people/?facetConnectionOf=%5B%22ACoAAB5drQkBVCiWvwyn6Cjt8rJy3KhkpwymuVw%22%5D&facetNetwork=%5B%22F%22%2C%22S%22%5D&origin=MEMBER_PROFILE_CANNED_SEARCH,https://www.linkedin.com/search/results/people/?facetNetwork=%5B%22F%22%5D&facetConnectionOf=%5B%22ACoAAB5drQkBVCiWvwyn6Cjt8rJy3KhkpwymuVw%22%5D&origin=MEMBER_PROFILE_CANNED_SEARCH&RESULT_TYPE=PEOPLE,WNS Global Services,https://www.linkedin.com/company/wns-global-services/,Full Stack Engineer,Banglore,Apr 2019 – Present,Maple CRM,https://www.linkedin.com/company/maple-crm/,Software Engineer,banglore,Aug 2016 – Mar 2019,Guru Ghasidas University,https://www.linkedin.com/school/13485/?legacySchoolId=13485,Engineer’s Degree,computer science and engineering,2012 – 2016,Jawahar Navodaya Vidyalaya Barwani(Indore) mp,,Matriculation,2009,http://www.wns.com,"C++, HTML, Java, php, SQL, c, css, Bootstrap, Ionic Framework, AngularJS, AJAX, Windows, JavaScript, Node.js, jQuery, MySQL, Git, JSON, Personal Development, Apache Cordova, High Performer",C++,0,HTML,0,Java,0,php,0,SQL,0,c,0,https://www.linkedin.com/in/varsha-mandloi-a35747122,varsha-mandloi-a35747122,2021-09-12T16:05:29.118Z,"Experienced Full Stack Developer with a demonstrated history of working in the computer software industry. Skilled in MySQL, PHP, Ionic Framework, angular js , Node Js, javascript, and Apache Cordova. Strong engineering professional with an Engineer’s Degree focused in computer science and engineering from Guru Ghasidas University. ",Research and Analytics Department,"Maths,Science,Social Science,English,Hindi"
https://www.linkedin.com/in/sachin-walunj-183b59b/,,Senior Software Engineer at Accelya Group,"Pune, Maharashtra, India",https://media-exp1.licdn.com/dms/image/C5603AQHTX6O9I54v4w/profile-displayphoto-shrink_800_800/0/1605461449599?e=1637193600&v=beta&t=UEoRDqyDdwAorqUBCr7djdZTHZv-C_ZSTuN2jVHq4qI,Sachin,Walunj,Sachin Walunj,2316,3rd+,ACoAAAIgxrMBb4kE6vqS9UNoIdP7Yxc_10Bd2oU,35702451,"https://www.linkedin.com/sales/people/ACoAAAIgxrMBb4kE6vqS9UNoIdP7Yxc_10Bd2oU,name",https://www.linkedin.com/search/results/people/?facetConnectionOf=%5B%22ACoAAAIgxrMBb4kE6vqS9UNoIdP7Yxc_10Bd2oU%22%5D&facetNetwork=%5B%22F%22%2C%22S%22%5D&origin=MEMBER_PROFILE_CANNED_SEARCH,https://www.linkedin.com/search/results/people/?facetNetwork=%5B%22F%22%5D&facetConnectionOf=%5B%22ACoAAAIgxrMBb4kE6vqS9UNoIdP7Yxc_10Bd2oU%22%5D&origin=MEMBER_PROFILE_CANNED_SEARCH&RESULT_TYPE=PEOPLE,Accelya Group,https://www.linkedin.com/company/accelya/,Senior Software Engineer,"Pune Area, India",Nov 2019 – Present,Zensar Technologies,https://www.linkedin.com/company/zensar/,Senior Software Engineer,"Pune, Maharashtra, India",Feb 2019 – Nov 2019,Sinhgad College of Engineering,https://www.linkedin.com/school/219056/?legacySchoolId=219056,Master's degree,Information Technology,2011 – 2013,"S.V.M.P.College of Engineering, Malegaon bk., Tal. Baramati, Dist Pune 413115",https://www.linkedin.com/school/207394/?legacySchoolId=207394,Bachelor's degree,2004 – 2008,,,,,,,,,,,,,,,https://www.linkedin.com/in/sachin-walunj-183b59b,sachin-walunj-183b59b,2021-09-12T16:05:47.916Z,"•	Having 9+ Years of Experience in Developing Websites and Web Applications Using HTML5, CSS3, JavaScript, Angular, Bootstrap.
•	Deep knowledge of Angular 2+. 
•      Hands-on experience on React and Vue.Js.
•	Expertise in Angular 7/8/9/10/11 to Create Simple and Scalable Code For SPA.
•	Hands on Experience on Angular CLI (Command Line Interface).
•	Experience in Using Chrome Developer Tools and Firebug for Debugging and Troubleshooting.
•	Extensively Work with Adobe Photoshop, Illustrator , Dreamweaver and Sketch.
•	Extensively Used the Repository Like GIT, SVN Bitbucket.
•	Extensively Worked on Unit Testing Using Karma and Jasmine.
•	Experience with Angular Material.
•	Knowledge of Material Design Principles and Responsive Design.
•	Experience with Agile Scrum Methodology.
•	Deep Knowledge of Modern JavaScript (ES2015 +) And Typescript
•	Excellent Understanding of Restful API.
•	Experience Managing and Mentoring Team Members
•	Good Team Player with Good Written and Verbal Communication Skills",,Computer Science
